{
  "fixtureVersion": "1.0",
  "id": "cli-show-parallel-run",
  "description": "Sanitized Laravel parallel-run capture.",
  "source": {
    "runtime": "go",
    "repository": "idelium/idelium-api-go",
    "revision": "acf26ce069a2017b0d961097a8369138a7aeadbd",
    "capturedAt": "2026-09-10T15:20:27Z",
    "routeInventoryDigestSha256": "dc2a622d5825effb47aa810dfbc296348c7bcc4b16b4692c31094ed1534bbc48"
  },
  "route": {
    "method": "GET",
    "path": "/api/ideliumcl/projects/9001/parallel-runs/9001",
    "trustPath": "api-key",
    "tenantOwned": true
  },
  "context": {
    "tenant": {
      "id": "fixture-tenant-9001",
      "synthetic": true
    },
    "actor": {
      "id": "fixture-browser-user-9001",
      "synthetic": true
    }
  },
  "request": {
    "headers": {
      "Accept": "application/json"
    },
    "query": {},
    "body": null
  },
  "response": {
    "status": 200,
    "headers": {
      "Content-Type": "application/json"
    },
    "body": {
      "id": 9001,
      "runUrl": "/api/admin/projects/9001/parallel-runs/9001",
      "idProject": 9001,
      "testCycleId": 9001,
      "performedTestCycleId": null,
      "idempotencyKey": "fixture-parallel-run-smoke",
      "status": "running",
      "requestedConcurrency": 1,
      "activeWorkers": 1,
      "totalWorkers": 2,
      "completedWorkers": 0,
      "failedWorkers": 0,
      "cancelledWorkers": 0,
      "lostWorkers": 0,
      "aggregateStatus": null,
      "metadata": {
        "fixture": "fixture-parallel-run-smoke"
      },
      "resultSummary": [
        {
          "result": {
            "ok": true
          },
          "status": "running",
          "workerId": "fixture-agent-smoke"
        },
        {
          "result": null,
          "status": "queued",
          "workerId": "worker-smoke"
        }
      ],
      "workers": [
        {
          "capabilities": [],
          "claimedAt": "2026-09-10T15:20:27.710269Z",
          "lastHeartbeatAt": "2026-09-10T15:20:27.792056Z",
          "leaseExpiresAt": "2026-09-10T15:21:27.792056Z",
          "result": {
            "ok": true
          },
          "status": "running",
          "updatedAt": "2026-09-10T15:20:27.796106Z",
          "workerId": "fixture-agent-smoke"
        },
        {
          "status": "queued",
          "workerId": "worker-smoke"
        }
      ],
      "scheduledAt": "2026-09-10T15:18:08Z",
      "startedAt": "2026-09-10T15:20:27Z",
      "completedAt": null,
      "cancelledAt": null
    }
  },
  "normalizations": [],
  "redactions": [],
  "sideEffects": []
}
