{
  "fixtureVersion": "1.0",
  "id": "cli-create-parallel-run-matrix",
  "description": "Sanitized Laravel parallel-run capture.",
  "source": {
    "runtime": "laravel",
    "repository": "idelium/idelium-api",
    "revision": "a5c22b37192da1ec41cd7be68e18f8363bccb4e3",
    "capturedAt": "2026-09-07T10:44:21Z",
    "routeInventoryDigestSha256": "dc2a622d5825effb47aa810dfbc296348c7bcc4b16b4692c31094ed1534bbc48"
  },
  "route": {
    "method": "POST",
    "path": "/api/ideliumcl/projects/9001/parallel-runs/matrix",
    "trustPath": "api-key",
    "tenantOwned": true
  },
  "context": {
    "tenant": {
      "id": "fixture-tenant-9001",
      "synthetic": true
    },
    "actor": {
      "id": "fixture-browser-user-9001",
      "synthetic": true
    }
  },
  "request": {
    "headers": {
      "Accept": "application/json"
    },
    "query": {},
    "body": null
  },
  "response": {
    "status": 201,
    "headers": {
      "Content-Type": "application/json"
    },
    "body": {
      "data": [
        {
          "id": 9005,
          "runUrl": "/api/admin/projects/9001/parallel-runs/9005",
          "idProject": 9001,
          "testCycleId": 9001,
          "performedTestCycleId": null,
          "idempotencyKey": "capture-cli-matrix-247fe3f8aa6e1bc1",
          "status": "queued",
          "requestedConcurrency": 1,
          "activeWorkers": null,
          "totalWorkers": null,
          "completedWorkers": null,
          "failedWorkers": null,
          "cancelledWorkers": null,
          "lostWorkers": 0,
          "aggregateStatus": null,
          "metadata": {
            "run": {
              "build": null,
              "commit": null,
              "branch": null,
              "repository": null,
              "initiator": null,
              "pipeline": null,
              "workloadIdentity": {
                "provider": null,
                "issuer": null,
                "subject": null,
                "audience": null
              }
            },
            "matrix": {
              "index": 0,
              "total": 1,
              "combination": {
                "platform": "9001",
                "browser": "9001",
                "environment": "9001"
              }
            },
            "executionSnapshot": {
              "schemaVersion": "2026-07-28",
              "testCycle": null,
              "tests": [
                {
                  "assetType": "test",
                  "assetId": 9001,
                  "version": null
                }
              ],
              "steps": [],
              "environments": []
            }
          },
          "resultSummary": [],
          "scheduledAt": "2026-09-07T10:44:21.000000Z",
          "startedAt": null,
          "completedAt": null,
          "cancelledAt": null
        }
      ],
      "summary": {
        "requestedRuns": 1,
        "scheduledRuns": 1
      }
    }
  },
  "normalizations": [],
  "redactions": [],
  "sideEffects": []
}
