{
  "fixtureVersion": "1.0",
  "id": "platform-operating-systems",
  "description": "Sanitized Laravel parallel-run capture.",
  "source": {
    "runtime": "laravel",
    "repository": "idelium/idelium-api",
    "revision": "c80769370eff568b39b4cd0832272897072a9594",
    "capturedAt": "2026-09-08T08:44:29Z",
    "routeInventoryDigestSha256": "dc2a622d5825effb47aa810dfbc296348c7bcc4b16b4692c31094ed1534bbc48"
  },
  "route": {
    "method": "GET",
    "path": "/api/admin/platforms/os/1",
    "trustPath": "browser-session",
    "tenantOwned": true
  },
  "context": {
    "tenant": {
      "id": "fixture-tenant-9001",
      "synthetic": true
    },
    "actor": {
      "id": "fixture-browser-user-9001",
      "synthetic": true
    }
  },
  "request": {
    "headers": {
      "Accept": "application/json"
    },
    "query": {},
    "body": null
  },
  "response": {
    "status": 200,
    "headers": {
      "Content-Type": "application/json"
    },
    "body": [
      {
        "id": 1,
        "name": "linux",
        "type": 1,
        "created_at": null,
        "updated_at": null
      },
      {
        "id": 2,
        "name": "windows",
        "type": 1,
        "created_at": null,
        "updated_at": null
      }
    ]
  },
  "normalizations": [],
  "redactions": [],
  "sideEffects": []
}
