{
  "fixtureVersion": "1.0",
  "id": "browser-cancel-parallel-run",
  "description": "Sanitized Laravel parallel-run capture.",
  "source": {
    "runtime": "go",
    "repository": "idelium/idelium-api-go",
    "revision": "7a89491567bb861d69c174bb23a931286e24ea18",
    "capturedAt": "2026-09-07T13:08:42Z",
    "routeInventoryDigestSha256": "dc2a622d5825effb47aa810dfbc296348c7bcc4b16b4692c31094ed1534bbc48"
  },
  "route": {
    "method": "POST",
    "path": "/api/admin/projects/9001/parallel-runs/9001/cancel",
    "trustPath": "browser-session",
    "tenantOwned": true
  },
  "context": {
    "tenant": {
      "id": "fixture-tenant-9001",
      "synthetic": true
    },
    "actor": {
      "id": "fixture-browser-user-9001",
      "synthetic": true
    }
  },
  "request": {
    "headers": {
      "Accept": "application/json"
    },
    "query": {},
    "body": null
  },
  "response": {
    "status": 200,
    "headers": {
      "Content-Type": "application/json"
    },
    "body": {
      "id": 9001,
      "runUrl": "/api/admin/projects/9001/parallel-runs/9001",
      "idProject": 9001,
      "testCycleId": 9001,
      "performedTestCycleId": null,
      "idempotencyKey": "fixture-parallel-run-smoke",
      "status": "completed",
      "requestedConcurrency": 1,
      "activeWorkers": 0,
      "totalWorkers": 1,
      "completedWorkers": 0,
      "failedWorkers": 0,
      "cancelledWorkers": 0,
      "lostWorkers": 0,
      "aggregateStatus": 1,
      "metadata": {
        "fixture": "fixture-parallel-run-smoke"
      },
      "resultSummary": [
        {
          "result": null,
          "status": "queued",
          "workerId": "worker-smoke"
        }
      ],
      "workers": [
        {
          "status": "queued",
          "workerId": "worker-smoke"
        }
      ],
      "scheduledAt": "2026-09-07T13:08:20Z",
      "startedAt": null,
      "completedAt": "2026-09-07T13:08:42Z",
      "cancelledAt": "2026-09-07T13:08:42Z"
    }
  },
  "normalizations": [],
  "redactions": [],
  "sideEffects": []
}
