{
  "fixtureVersion": "1.0",
  "id": "platform-types",
  "description": "Sanitized Laravel parallel-run capture.",
  "source": {
    "runtime": "go",
    "repository": "idelium/idelium-api-go",
    "revision": "e5dcc5632f9adee81f54b9cf923983917a64ef75",
    "capturedAt": "2026-09-08T08:47:03Z",
    "routeInventoryDigestSha256": "dc2a622d5825effb47aa810dfbc296348c7bcc4b16b4692c31094ed1534bbc48"
  },
  "route": {
    "method": "GET",
    "path": "/api/admin/platforms/types",
    "trustPath": "browser-session",
    "tenantOwned": true
  },
  "context": {
    "tenant": {
      "id": "fixture-tenant-9001",
      "synthetic": true
    },
    "actor": {
      "id": "fixture-browser-user-9001",
      "synthetic": true
    }
  },
  "request": {
    "headers": {
      "Accept": "application/json"
    },
    "query": {},
    "body": null
  },
  "response": {
    "status": 200,
    "headers": {
      "Content-Type": "application/json"
    },
    "body": [
      {
        "id": 1,
        "name": "desktop"
      },
      {
        "id": 2,
        "name": "mobile"
      }
    ]
  },
  "normalizations": [],
  "redactions": [],
  "sideEffects": []
}
