{
  "fixtureVersion": "1.0",
  "id": "cli-create-parallel-run-matrix",
  "description": "Sanitized Laravel parallel-run capture.",
  "source": {
    "runtime": "go",
    "repository": "idelium/idelium-api-go",
    "revision": "acf26ce069a2017b0d961097a8369138a7aeadbd",
    "capturedAt": "2026-09-10T15:20:27Z",
    "routeInventoryDigestSha256": "dc2a622d5825effb47aa810dfbc296348c7bcc4b16b4692c31094ed1534bbc48"
  },
  "route": {
    "method": "POST",
    "path": "/api/ideliumcl/projects/9001/parallel-runs/matrix",
    "trustPath": "api-key",
    "tenantOwned": true
  },
  "context": {
    "tenant": {
      "id": "fixture-tenant-9001",
      "synthetic": true
    },
    "actor": {
      "id": "fixture-browser-user-9001",
      "synthetic": true
    }
  },
  "request": {
    "headers": {
      "Accept": "application/json"
    },
    "query": {},
    "body": {
      "testCycleId": 9001,
      "idempotencyKey": "capture-cli-matrix",
      "matrix": {
        "platforms": [
          9001
        ],
        "browsers": [
          9001
        ],
        "environments": [
          9001
        ]
      }
    }
  },
  "response": {
    "status": 201,
    "headers": {
      "Content-Type": "application/json"
    },
    "body": {
      "data": [
        {
          "id": 9007,
          "runUrl": "/api/admin/projects/9001/parallel-runs/9007",
          "idProject": 9001,
          "testCycleId": 9001,
          "performedTestCycleId": null,
          "idempotencyKey": "capture-cli-matrix-247fe3f8aa6e1bc1",
          "status": "queued",
          "requestedConcurrency": 1,
          "activeWorkers": 0,
          "totalWorkers": 0,
          "completedWorkers": 0,
          "failedWorkers": 0,
          "cancelledWorkers": 0,
          "lostWorkers": 0,
          "aggregateStatus": null,
          "metadata": {
            "executionSnapshot": {
              "environments": [],
              "schemaVersion": "2026-07-28",
              "steps": [],
              "testCycle": {
                "assetId": 9001,
                "assetType": "test_cycle",
                "version": 1,
                "versionId": 1
              },
              "tests": [
                {
                  "assetId": 9001,
                  "assetType": "test",
                  "version": 1,
                  "versionId": 2
                }
              ]
            },
            "matrix": {
              "combination": {
                "browser": "9001",
                "environment": "9001",
                "platform": "9001"
              },
              "index": 0,
              "total": 1
            },
            "run": {
              "branch": null,
              "build": null,
              "commit": null,
              "initiator": null,
              "pipeline": null,
              "repository": null,
              "workloadIdentity": {
                "audience": null,
                "issuer": null,
                "provider": null,
                "subject": null
              }
            }
          },
          "resultSummary": {},
          "scheduledAt": "2026-09-10T15:20:27Z",
          "startedAt": null,
          "completedAt": null,
          "cancelledAt": null
        }
      ],
      "summary": {
        "requestedRuns": 1,
        "scheduledRuns": 1
      }
    }
  },
  "normalizations": [],
  "redactions": [],
  "sideEffects": [
    {
      "kind": "route-mutation",
      "method": "POST",
      "path": "/api/ideliumcl/projects/9001/parallel-runs/matrix"
    }
  ]
}
