{
  "fixtureVersion": "1.0",
  "id": "cli-issue-parallel-run-token",
  "description": "Sanitized Laravel parallel-run capture.",
  "source": {
    "runtime": "laravel",
    "repository": "idelium/idelium-api",
    "revision": "30843a0cfd57650150319ddde3e66db379fdfd8f",
    "capturedAt": "2026-09-07T10:48:25Z",
    "routeInventoryDigestSha256": "dc2a622d5825effb47aa810dfbc296348c7bcc4b16b4692c31094ed1534bbc48"
  },
  "route": {
    "method": "POST",
    "path": "/api/ideliumcl/projects/9001/parallel-runs/9001/tokens",
    "trustPath": "api-key",
    "tenantOwned": true
  },
  "context": {
    "tenant": {
      "id": "fixture-tenant-9001",
      "synthetic": true
    },
    "actor": {
      "id": "fixture-browser-user-9001",
      "synthetic": true
    }
  },
  "request": {
    "headers": {
      "Accept": "application/json"
    },
    "query": {},
    "body": null
  },
  "response": {
    "status": 201,
    "headers": {
      "Content-Type": "application/json"
    },
    "body": {
      "expiresAt": "2026-09-07T10:53:25.000000Z",
      "agentId": "fixture-agent-smoke"
    }
  },
  "normalizations": [],
  "redactions": [],
  "sideEffects": []
}
