{
  "fixtureVersion": "1.0",
  "id": "browser-list-parallel-runs",
  "description": "Sanitized Laravel parallel-run capture.",
  "source": {
    "runtime": "go",
    "repository": "idelium/idelium-api-go",
    "revision": "4707cc697ead0a2111b1b26fd9d3b9257e1ce6a2",
    "capturedAt": "2026-09-07T13:45:56Z",
    "routeInventoryDigestSha256": "dc2a622d5825effb47aa810dfbc296348c7bcc4b16b4692c31094ed1534bbc48"
  },
  "route": {
    "method": "GET",
    "path": "/api/admin/projects/9001/parallel-runs",
    "trustPath": "browser-session",
    "tenantOwned": true
  },
  "context": {
    "tenant": {
      "id": "fixture-tenant-9001",
      "synthetic": true
    },
    "actor": {
      "id": "fixture-browser-user-9001",
      "synthetic": true
    }
  },
  "request": {
    "headers": {
      "Accept": "application/json"
    },
    "query": {},
    "body": null
  },
  "response": {
    "status": 200,
    "headers": {
      "Content-Type": "application/json"
    },
    "body": [
      {
        "id": 9001,
        "runUrl": "/api/admin/projects/9001/parallel-runs/9001",
        "idProject": 9001,
        "testCycleId": 9001,
        "performedTestCycleId": null,
        "idempotencyKey": "fixture-parallel-run-smoke",
        "status": "scheduled",
        "requestedConcurrency": 1,
        "activeWorkers": 0,
        "totalWorkers": 0,
        "completedWorkers": 0,
        "failedWorkers": 0,
        "cancelledWorkers": 0,
        "lostWorkers": 0,
        "aggregateStatus": null,
        "metadata": {
          "fixture": "fixture-parallel-run-smoke"
        },
        "resultSummary": {},
        "workers": [
          {
            "status": "queued",
            "workerId": "worker-smoke"
          }
        ],
        "scheduledAt": "2026-09-07T13:45:28Z",
        "startedAt": null,
        "completedAt": null,
        "cancelledAt": null
      }
    ]
  },
  "normalizations": [],
  "redactions": [],
  "sideEffects": []
}
