{
  "fixtureVersion": "1.0",
  "id": "runner-claim",
  "description": "Sanitized Laravel parallel-run capture.",
  "source": {
    "runtime": "laravel",
    "repository": "idelium/idelium-api",
    "revision": "ef97a6b3f42105cad583b3f1a68acf637a9d086a",
    "capturedAt": "2026-09-10T15:14:23Z",
    "routeInventoryDigestSha256": "dc2a622d5825effb47aa810dfbc296348c7bcc4b16b4692c31094ed1534bbc48"
  },
  "route": {
    "method": "POST",
    "path": "/api/ideliumrunner/claim",
    "trustPath": "run-token",
    "tenantOwned": true
  },
  "context": {
    "tenant": {
      "id": "fixture-tenant-9001",
      "synthetic": true
    },
    "actor": {
      "id": "fixture-browser-user-9001",
      "synthetic": true
    }
  },
  "request": {
    "headers": {
      "Accept": "application/json"
    },
    "query": {},
    "body": {
      "idProject": 9001,
      "parallelRun": 9001,
      "workerId": "fixture-agent-smoke"
    }
  },
  "response": {
    "status": 200,
    "headers": {
      "Content-Type": "application/json"
    },
    "body": {
      "id": 9001,
      "runUrl": "/api/admin/projects/9001/parallel-runs/9001",
      "idProject": 9001,
      "testCycleId": 9001,
      "performedTestCycleId": null,
      "idempotencyKey": "fixture-parallel-run-smoke",
      "status": "running",
      "requestedConcurrency": 1,
      "activeWorkers": 1,
      "totalWorkers": 1,
      "completedWorkers": 0,
      "failedWorkers": 0,
      "cancelledWorkers": 0,
      "lostWorkers": 0,
      "aggregateStatus": null,
      "metadata": {
        "fixture": "fixture-parallel-run-smoke"
      },
      "resultSummary": [
        {
          "workerId": "fixture-agent-smoke",
          "status": "running",
          "result": {
            "ok": true
          }
        }
      ],
      "scheduledAt": "2026-09-10T15:11:26.000000Z",
      "startedAt": "2026-09-10T15:14:22.000000Z",
      "completedAt": null,
      "cancelledAt": null
    }
  },
  "normalizations": [],
  "redactions": [],
  "sideEffects": [
    {
      "kind": "route-mutation",
      "method": "POST",
      "path": "/api/ideliumrunner/claim"
    }
  ]
}
