{
  "fixtureVersion": "1.0",
  "id": "cli-claim-parallel-run",
  "description": "Sanitized Laravel parallel-run capture.",
  "source": {
    "runtime": "laravel",
    "repository": "idelium/idelium-api",
    "revision": "e6af3eb41d8c65108c95157198144c94fb5259ba",
    "capturedAt": "2026-09-07T09:12:39Z",
    "routeInventoryDigestSha256": "dc2a622d5825effb47aa810dfbc296348c7bcc4b16b4692c31094ed1534bbc48"
  },
  "route": {
    "method": "POST",
    "path": "/api/ideliumcl/projects/9001/parallel-runs/9001/claim",
    "trustPath": "api-key",
    "tenantOwned": true
  },
  "context": {
    "tenant": {
      "id": "fixture-tenant-9001",
      "synthetic": true
    },
    "actor": {
      "id": "fixture-browser-user-9001",
      "synthetic": true
    }
  },
  "request": {
    "headers": {
      "Accept": "application/json"
    },
    "query": {},
    "body": null
  },
  "response": {
    "status": 200,
    "headers": {
      "Content-Type": "application/json"
    },
    "body": {
      "id": 9001,
      "runUrl": "/api/admin/projects/9001/parallel-runs/9001",
      "idProject": 9001,
      "testCycleId": 9001,
      "performedTestCycleId": null,
      "idempotencyKey": "fixture-parallel-run-smoke",
      "status": "running",
      "requestedConcurrency": 1,
      "activeWorkers": 1,
      "totalWorkers": 1,
      "completedWorkers": 0,
      "failedWorkers": 0,
      "cancelledWorkers": 0,
      "lostWorkers": 0,
      "aggregateStatus": null,
      "metadata": {
        "fixture": "fixture-parallel-run-smoke"
      },
      "resultSummary": [
        {
          "workerId": "fixture-agent-smoke",
          "status": "running",
          "result": null
        }
      ],
      "scheduledAt": "2026-09-07T09:12:25.000000Z",
      "startedAt": "2026-09-07T09:12:39.000000Z",
      "completedAt": null,
      "cancelledAt": null
    }
  },
  "normalizations": [],
  "redactions": [],
  "sideEffects": []
}
