{
  "fixtureVersion": "1.0",
  "id": "project-create-authorized-go",
  "description": "Synthetic authorized Go mutation for creating a project.",
  "source": {
    "runtime": "go",
    "repository": "idelium/idelium-api-go",
    "revision": "0123456789abcdef0123456789abcdef01234567",
    "capturedAt": "2026-08-24T12:30:00Z",
    "routeInventoryDigestSha256": "0ba5e5d3ff27afdba1e3c32619af26e66ff26022570a6a730b1ce93145ccffd9"
  },
  "route": {
    "method": "POST",
    "path": "/api/admin/projects",
    "trustPath": "browser-session",
    "tenantOwned": true
  },
  "context": {
    "tenant": {
      "id": "fixture-tenant-alpha",
      "synthetic": true
    },
    "actor": {
      "id": "fixture-actor-admin",
      "synthetic": true
    }
  },
  "request": {
    "headers": {
      "Accept": "application/json",
      "Content-Type": "application/json",
      "X-Correlation-ID": "fixture-correlation-project-create-go"
    },
    "query": {},
    "body": {
      "project": "fixture-project-alpha",
      "description": "Synthetic project created by the migration comparator."
    }
  },
  "response": {
    "status": 200,
    "headers": {
      "Content-Type": "application/json"
    },
    "body": {
      "id": 9001,
      "project": "fixture-project-alpha",
      "description": "Synthetic project created by the migration comparator."
    }
  },
  "normalizations": [
    {
      "path": "$.request.headers.X-Correlation-ID",
      "rule": "Replace the generated correlation identifier with a stable fixture value."
    },
    {
      "path": "$.source.capturedAt",
      "rule": "Use a fixed UTC timestamp."
    },
    {
      "path": "$.response.body.id",
      "rule": "Normalize generated database ID."
    },
    {
      "path": "$.sideEffects[0].row.id",
      "rule": "Normalize generated database ID."
    },
    {
      "path": "$.sideEffects[0].row.created_at",
      "rule": "Normalize generated timestamp."
    }
  ],
  "redactions": [
    {
      "path": "$.request.headers.Authorization",
      "rule": "Remove the browser credential before the fixture is persisted."
    },
    {
      "path": "$.request.headers.Cookie",
      "rule": "Remove all session and CSRF cookies before the fixture is persisted."
    }
  ],
  "sideEffects": [
    {
      "table": "projects",
      "operation": "insert",
      "tenantId": "fixture-tenant-alpha",
      "naturalKey": "fixture-project-alpha",
      "row": {
        "id": 9001,
        "project": "fixture-project-alpha",
        "description": "Synthetic project created by the migration comparator.",
        "created_at": "2026-08-24T12:30:00Z"
      }
    }
  ]
}
